{
  "$schema": "https://rmside.invalid/schemas/constant-kinds/v1",
  "schemaVersion": "1.0.0",
  "compatibility": { "minimumMajor": 1, "maximumMajor": 1 },
  "profileId": "aoe2de-101.103.54800-rms-v1",
  "derivationContract": "aoe2de-definition-heading-kinds-v1",
  "entries": [
    {
      "tableId": "aoe2de-101.103.54800.0-constant-kinds-v1",
      "productVersion": "101.103.54800.0",
      "source": "definition-file-headings",
      "provenance": {
        "tool": "tools/derive-constant-kinds.mjs",
        "installationBuild": "101.103.54800.0",
        "inputFile": "resources/_common/drs/gamedata_x2/random_map.def",
        "inputSha256": "7940cbd595a7fa8c3913c784397f9e549008a84027bdc2b1b340f6a7d84df753",
        "definitionsSha256": "2d3281f2290d996c735a4cceca8b28e674a155fd3e7c74472f8885307845be44",
        "derivedOn": "2026-10-04"
      },
      "names": [
        { "name": "ACCLIVITY", "kind": "map-type" },
        { "name": "ACROPOLIS", "kind": "map-type" },
        { "name": "ADD_ATTRIBUTE", "kind": "effect" },
        { "name": "ADD_TECH_COST", "kind": "effect" },
        { "name": "ADMIRAL_YI_SUN_SHIN", "kind": "object" },
        { "name": "AETHELFIRTH", "kind": "object" },
        { "name": "AFRICAN_CLEARING", "kind": "map-type" },
        { "name": "AFTERMATH", "kind": "map-type" },
        { "name": "ALARIC_THE_GOTH", "kind": "object" },
        { "name": "ALEXANDER_NEVSKI", "kind": "object" },
        { "name": "ALPACA", "kind": "object" },
        { "name": "ALPINE_LAKES", "kind": "map-type" },
        { "name": "AMAZON_TUNNEL", "kind": "map-type" },
        { "name": "AMOUNT_BONUS_POPULATION_CAP", "kind": "resource" },
        { "name": "AMOUNT_BUILDING_TRICKLE_FOOD", "kind": "resource" },
        { "name": "AMOUNT_BUILDING_TRICKLE_GOLD", "kind": "resource" },
        { "name": "AMOUNT_BUILDING_TRICKLE_STONE", "kind": "resource" },
        { "name": "AMOUNT_BUILDING_TRICKLE_WOOD", "kind": "resource" },
        { "name": "AMOUNT_CONVERT_BUILDING", "kind": "resource" },
        { "name": "AMOUNT_CONVERT_PRIEST", "kind": "resource" },
        { "name": "AMOUNT_ELEVATION_HIGHER_BONUS", "kind": "resource" },
        { "name": "AMOUNT_ELEVATION_LOWER_BONUS", "kind": "resource" },
        { "name": "AMOUNT_FOOD", "kind": "resource" },
        { "name": "AMOUNT_FOOD_GENERATION", "kind": "resource" },
        { "name": "AMOUNT_GOLD", "kind": "resource" },
        { "name": "AMOUNT_GOLD_GENERATION", "kind": "resource" },
        { "name": "AMOUNT_MONUMENT_TRICKLE_FOOD", "kind": "resource" },
        { "name": "AMOUNT_MONUMENT_TRICKLE_GOLD", "kind": "resource" },
        { "name": "AMOUNT_MONUMENT_TRICKLE_STONE", "kind": "resource" },
        { "name": "AMOUNT_MONUMENT_TRICKLE_WOOD", "kind": "resource" },
        { "name": "AMOUNT_POPULATION", "kind": "resource" },
        { "name": "AMOUNT_POPULATION_CAP", "kind": "resource" },
        { "name": "AMOUNT_REVEAL_ENEMY", "kind": "resource" },
        { "name": "AMOUNT_REVEAL_RELICS", "kind": "resource" },
        { "name": "AMOUNT_STARTING_FOOD", "kind": "resource" },
        { "name": "AMOUNT_STARTING_GOLD", "kind": "resource" },
        { "name": "AMOUNT_STARTING_STONE", "kind": "resource" },
        { "name": "AMOUNT_STARTING_WOOD", "kind": "resource" },
        { "name": "AMOUNT_STONE", "kind": "resource" },
        { "name": "AMOUNT_STONE_GENERATION", "kind": "resource" },
        { "name": "AMOUNT_TOWN_CENTER_UNAVAILABLE", "kind": "resource" },
        { "name": "AMOUNT_WOOD", "kind": "resource" },
        { "name": "AMOUNT_WOOD_GENERATION", "kind": "resource" },
        { "name": "AMOUNT_WORKSHOP_TRICKLE_FOOD", "kind": "resource" },
        { "name": "AMOUNT_WORKSHOP_TRICKLE_GOLD", "kind": "resource" },
        { "name": "AMOUNT_WORKSHOP_TRICKLE_STONE", "kind": "resource" },
        { "name": "AMOUNT_WORKSHOP_TRICKLE_WOOD", "kind": "resource" },
        { "name": "AQUARENA", "kind": "map-type" },
        { "name": "ARABIA", "kind": "map-type" },
        { "name": "ARABIAN_DESERT", "kind": "map-type" },
        { "name": "ARABIAN_WOLF", "kind": "object" },
        { "name": "ARBALEST", "kind": "object" },
        { "name": "ARCHBISHOP", "kind": "object" },
        { "name": "ARCHER", "kind": "object" },
        { "name": "ARCHERS_OF_THE_EYES", "kind": "object" },
        { "name": "ARCHERY_CANNON_CLASS", "kind": "object-class" },
        { "name": "ARCHERY_CLASS", "kind": "object-class" },
        { "name": "ARCHERY_RANGE", "kind": "object" },
        { "name": "ARCHERY_RANGE_C", "kind": "object" },
        { "name": "ARCHERY_RANGE_I", "kind": "object" },
        { "name": "ARCHIPELAGO", "kind": "map-type" },
        { "name": "ARCTIC_FOX", "kind": "object" },
        { "name": "ARCTIC_HARE", "kind": "object" },
        { "name": "ARCTIC_WOLF", "kind": "object" },
        { "name": "ARENA", "kind": "map-type" },
        { "name": "ARGALI", "kind": "object" },
        { "name": "ARTIFACT_CLASS", "kind": "object-class" },
        { "name": "ASIAN_MAPLE_AUTUMN_TREE", "kind": "object" },
        { "name": "ASIAN_MAPLE_GREEN_TREE", "kind": "object" },
        { "name": "ASIAN_PINE_TREE", "kind": "object" },
        { "name": "ATACAMA", "kind": "map-type" },
        { "name": "ATTILA_THE_HUN", "kind": "object" },
        { "name": "ATTR_ACCURACY_PERCENT", "kind": "attribute" },
        { "name": "ATTR_ADD", "kind": "effect-type" },
        { "name": "ATTR_ADD_ARMOR_TYPE", "kind": "attribute" },
        { "name": "ATTR_ADD_ATTACK_TYPE", "kind": "attribute" },
        { "name": "ATTR_ADD_FOOD_COST", "kind": "modify-tech" },
        { "name": "ATTR_ADD_GOLD_COST", "kind": "modify-tech" },
        { "name": "ATTR_ADD_STONE_COST", "kind": "modify-tech" },
        { "name": "ATTR_ADD_TIME", "kind": "modify-tech" },
        { "name": "ATTR_ADD_WOOD_COST", "kind": "modify-tech" },
        { "name": "ATTR_AMOUNT_FIRST_COST", "kind": "attribute" },
        { "name": "ATTR_AMOUNT_SECOND_COST", "kind": "attribute" },
        { "name": "ATTR_AMOUNT_THIRD_COST", "kind": "attribute" },
        { "name": "ATTR_ANNEX_UNIT1", "kind": "attribute" },
        { "name": "ATTR_ANNEX_UNIT1_OFFSET_X", "kind": "attribute" },
        { "name": "ATTR_ANNEX_UNIT1_OFFSET_Y", "kind": "attribute" },
        { "name": "ATTR_ANNEX_UNIT2", "kind": "attribute" },
        { "name": "ATTR_ANNEX_UNIT2_OFFSET_X", "kind": "attribute" },
        { "name": "ATTR_ANNEX_UNIT2_OFFSET_Y", "kind": "attribute" },
        { "name": "ATTR_ANNEX_UNIT3", "kind": "attribute" },
        { "name": "ATTR_ANNEX_UNIT3_OFFSET_X", "kind": "attribute" },
        { "name": "ATTR_ANNEX_UNIT3_OFFSET_Y", "kind": "attribute" },
        { "name": "ATTR_ANNEX_UNIT4", "kind": "attribute" },
        { "name": "ATTR_ANNEX_UNIT4_OFFSET_X", "kind": "attribute" },
        { "name": "ATTR_ANNEX_UNIT4_OFFSET_Y", "kind": "attribute" },
        { "name": "ATTR_AREA_DAMAGE", "kind": "attribute" },
        { "name": "ATTR_ARMOR", "kind": "attribute" },
        { "name": "ATTR_ATTACK", "kind": "attribute" },
        { "name": "ATTR_ATTACK2_GRAPHIC", "kind": "attribute" },
        { "name": "ATTR_ATTACK_DELAY", "kind": "attribute" },
        { "name": "ATTR_ATTACK_DISPERSION", "kind": "attribute" },
        { "name": "ATTR_ATTACK_GRAPHIC", "kind": "attribute" },
        { "name": "ATTR_ATTACK_PRIORITY", "kind": "attribute" },
        { "name": "ATTR_AVAILABLE_FLAG", "kind": "attribute" },
        { "name": "ATTR_BASE_ARMOR", "kind": "attribute" },
        { "name": "ATTR_BLAST_DEFENSE", "kind": "attribute" },
        { "name": "ATTR_BLAST_LEVEL", "kind": "attribute" },
        { "name": "ATTR_BLAST_RADIUS", "kind": "attribute" },
        { "name": "ATTR_BLOCKAGE_CLASS", "kind": "attribute" },
        { "name": "ATTR_BLOOD_ID", "kind": "attribute" },
        { "name": "ATTR_BUILD_AND_GO_AWAY", "kind": "attribute" },
        { "name": "ATTR_BUTTON_ICON_ID", "kind": "attribute" },
        { "name": "ATTR_CAN_BE_BUILT_ON", "kind": "attribute" },
        { "name": "ATTR_CAN_BE_GATHERED", "kind": "attribute" },
        { "name": "ATTR_CAN_BURN", "kind": "attribute" },
        { "name": "ATTR_CHARGE_EVENT", "kind": "attribute" },
        { "name": "ATTR_CHARGE_PROJECTILE_ID", "kind": "attribute" },
        { "name": "ATTR_CHARGE_TARGET", "kind": "attribute" },
        { "name": "ATTR_CHARGE_TYPE", "kind": "attribute" },
        { "name": "ATTR_CLEARANCE_SIZE_X", "kind": "attribute" },
        { "name": "ATTR_CLEARANCE_SIZE_Y", "kind": "attribute" },
        { "name": "ATTR_COMBAT_ABILITY", "kind": "attribute" },
        { "name": "ATTR_COMBAT_LEVEL", "kind": "attribute" },
        { "name": "ATTR_COMMAND_SOUND", "kind": "attribute" },
        { "name": "ATTR_COMMAND_SOUND_EVENT", "kind": "attribute" },
        { "name": "ATTR_CONSTRUCTION_GRAPHIC", "kind": "attribute" },
        { "name": "ATTR_CONSTRUCTION_SOUND", "kind": "attribute" },
        { "name": "ATTR_CONSTRUCTION_SOUND_EVENT", "kind": "attribute" },
        { "name": "ATTR_CONV_CHANCE_MOD", "kind": "attribute" },
        { "name": "ATTR_CREATE_SDESC_ID", "kind": "attribute" },
        { "name": "ATTR_CREATION_TIME", "kind": "attribute" },
        { "name": "ATTR_DAMAGE_GRAPHIC", "kind": "attribute" },
        { "name": "ATTR_DAMAGE_GRAPHICS_ENTRY_MOD", "kind": "attribute" },
        { "name": "ATTR_DAMAGE_GRAPHICS_TOTAL_NUM", "kind": "attribute" },
        { "name": "ATTR_DAMAGE_GRAPHIC_APPLY_MODE", "kind": "attribute" },
        { "name": "ATTR_DAMAGE_GRAPHIC_PERCENT", "kind": "attribute" },
        { "name": "ATTR_DAMAGE_REFLECTION", "kind": "attribute" },
        { "name": "ATTR_DAMAGE_SOUND", "kind": "attribute" },
        { "name": "ATTR_DAMAGE_SOUND_EVENT", "kind": "attribute" },
        { "name": "ATTR_DEAD_ID", "kind": "attribute" },
        { "name": "ATTR_DEDUCT_FLAG_FIRST_COST", "kind": "attribute" },
        { "name": "ATTR_DEDUCT_FLAG_SECOND_COST", "kind": "attribute" },
        { "name": "ATTR_DEDUCT_FLAG_THIRD_COST", "kind": "attribute" },